{
  "$schema": "./agent-access-policy.schema.json",
  "schema_version": "agent_access_policy.v1",
  "policy_version": 1,
  "default_role": "monitor",
  "capabilities": {
    "github": {
      "repository": "dennisonbertram/harness-arena",
      "allowed_identity_kinds": ["fine_grained_pat", "github_app", "authenticated_user"],
      "required_read_permissions": ["metadata", "contents", "actions", "issues", "pull_requests"],
      "write_permissions_allowed": false
    },
    "vercel": {
      "required_team_role": "VIEWER",
      "required_project_role": "VIEWER",
      "project_ids": ["prj_f4ppu0xpO0LZeHOAH99RHotVbwyo", "prj_YcSCWVj8OBPQ9XmQVuCGz4AMV2WA"],
      "static_project_scoped_viewer_token_available": false,
      "decrypted_environment_values_allowed": false
    },
    "get_only_ops": {
      "credential": "OPS_READ_TOKEN",
      "methods": ["GET"],
      "write_methods": ["POST", "PUT", "PATCH", "DELETE"],
      "write_expected_status": 405,
      "separate_from": ["AUTH_SECRET", "AUTH_GITHUB_SECRET", "COMPETITION_ADMIN_TOKEN", "RUNNER_CALLBACK_SECRET", "OPS_READ_CURSOR_SECRET", "BLOB_READ_WRITE_TOKEN", "AI_GATEWAY_API_KEY", "OPENROUTER_API_KEY", "GH_TOKEN", "GITHUB_TOKEN", "VERCEL_TOKEN"],
      "targets": {
        "production": {
          "project_id": "prj_f4ppu0xpO0LZeHOAH99RHotVbwyo",
          "hosts": ["harness-arena-psi.vercel.app"],
          "https_required": true
        },
        "development": {
          "project_id": "prj_YcSCWVj8OBPQ9XmQVuCGz4AMV2WA",
          "hosts": ["harness-arena-development.vercel.app", "harness-arena-git-codex-dev-environme-19f8e1-dennisons-projects.vercel.app"],
          "https_required": true
        },
        "local": {
          "project_id": null,
          "hosts": ["127.0.0.1", "localhost", "[::1]"],
          "https_required": false
        }
      }
    },
    "blob": { "direct_credential_allowed": false, "read_via": "get_only_ops" },
    "sandbox": { "direct_credential_allowed": false, "read_via": "get_only_ops" },
    "ai_gateway": { "spend_credential_allowed": false, "read_via": "vercel_logs" },
    "secrets": { "allowed_standing_credentials": ["OPS_READ_TOKEN"], "other_static_values_allowed": false, "metadata_allowed": true, "value_handling": "protected_ephemeral_only", "file_mode": "0600" }
  },
  "roles": {
    "monitor": { "purpose": "Continuous read-only health and deployment observation", "capabilities": ["github", "vercel", "get_only_ops", "blob", "sandbox", "ai_gateway", "secrets"], "standing_credentials": ["OPS_READ_TOKEN"], "secret_value_access": "metadata_only" },
    "diagnostic": { "purpose": "Read-only incident diagnosis with protected ephemeral secret-value access only when separately authorized", "capabilities": ["github", "vercel", "get_only_ops", "blob", "sandbox", "ai_gateway", "secrets"], "standing_credentials": ["OPS_READ_TOKEN"], "secret_value_access": "protected_ephemeral_only" }
  },
  "environment_inventory": {
    "source_paths": ["app", "lib", "mcp/src", "scripts", "next.config.ts", "instrumentation.ts"],
    "exclude_directories": ["node_modules", ".next", "coverage", "fixtures", "tests"],
    "exclude_suffixes": [".test.", ".spec.", "scripts/tests/"],
    "approved_dynamic_access": [
      { "file": "next.config.ts", "accessor": "key", "bounded_by": "LOCAL_NEUTRALIZED_ENV_KEYS" },
      { "file": "app/api/ready/route.ts", "accessor": "key", "bounded_by": "LOCAL_NEUTRALIZED_ENV_KEYS" },
      { "file": "lib/sandbox.ts", "accessor": "name", "bounded_by": "requireEnv call sites" }
    ],
    "variables": {
      "AGENTKIT_TGZ": { "purpose": "Runner AgentKit archive path", "environments": ["runner"], "secret": false, "owner": "runner", "required": "conditional", "safe_diagnostic": "value_non_secret" },
      "AI_GATEWAY_API_KEY": { "purpose": "AI Gateway spend credential", "environments": ["production", "development", "runner"], "secret": true, "owner": "vercel-ai-gateway", "required": "runtime", "safe_diagnostic": "metadata_presence_only" },
      "AUTH_GITHUB_ID": { "purpose": "GitHub OAuth client identifier", "environments": ["production", "development"], "secret": false, "owner": "github", "required": "auth", "safe_diagnostic": "metadata_presence_only" },
      "AUTH_GITHUB_SECRET": { "purpose": "GitHub OAuth client secret", "environments": ["production", "development"], "secret": true, "owner": "github", "required": "auth", "safe_diagnostic": "metadata_presence_only" },
      "AUTH_SECRET": { "purpose": "Application session signing secret", "environments": ["production", "development"], "secret": true, "owner": "application", "required": "auth", "safe_diagnostic": "metadata_presence_only" },
      "BASE": { "purpose": "Operator script target origin", "environments": ["ops"], "secret": false, "owner": "operator", "required": "optional", "safe_diagnostic": "sanitized_origin" },
      "BLOB_READ_WRITE_TOKEN": { "purpose": "Vercel Blob read-write application credential", "environments": ["production", "development", "ops"], "secret": true, "owner": "vercel-blob", "required": "runtime", "safe_diagnostic": "metadata_presence_only" },
      "BUDGET_CAP_USD": { "purpose": "Runner cost ceiling", "environments": ["runner"], "secret": false, "owner": "runner", "required": "optional", "safe_diagnostic": "value_non_secret" },
      "CALLBACK_BASE": { "purpose": "Runner callback origin", "environments": ["production", "development", "runner"], "secret": false, "owner": "application", "required": "runtime", "safe_diagnostic": "sanitized_origin" },
      "COMPETITION_ADMIN_TOKEN": { "purpose": "Competition administration credential", "environments": ["production", "development"], "secret": true, "owner": "application", "required": "admin_only", "safe_diagnostic": "metadata_presence_only" },
      "COMPETITION_GATEWAY_PROVIDER": { "purpose": "Competition model provider pin", "environments": ["production", "development", "ops"], "secret": false, "owner": "application", "required": "optional", "safe_diagnostic": "value_non_secret" },
      "COMPETITION_MODEL": { "purpose": "Competition model selection", "environments": ["production", "development", "ops"], "secret": false, "owner": "application", "required": "optional", "safe_diagnostic": "value_non_secret" },
      "DOCKER_CMD": { "purpose": "Runner Docker executable override", "environments": ["runner"], "secret": false, "owner": "runner", "required": "optional", "safe_diagnostic": "value_non_secret" },
      "GATEWAY_ONLY": { "purpose": "Gateway upstream provider allowlist", "environments": ["runner"], "secret": false, "owner": "runner", "required": "optional", "safe_diagnostic": "value_non_secret" },
      "GATEWAY_PROXY_PORT": { "purpose": "Runner gateway proxy port", "environments": ["runner"], "secret": false, "owner": "runner", "required": "optional", "safe_diagnostic": "value_non_secret" },
      "GATEWAY_UPSTREAM": { "purpose": "AI Gateway upstream origin", "environments": ["runner"], "secret": false, "owner": "runner", "required": "optional", "safe_diagnostic": "sanitized_origin" },
      "GITHUB_EVENT_PATH": { "purpose": "GitHub Actions event payload path", "environments": ["ci"], "secret": false, "owner": "github-actions", "required": "ci", "safe_diagnostic": "path_basename_only" },
      "GITHUB_REPOSITORY": { "purpose": "GitHub Actions repository identity", "environments": ["ci"], "secret": false, "owner": "github-actions", "required": "ci", "safe_diagnostic": "value_non_secret" },
      "GITHUB_TOKEN": { "purpose": "GitHub Actions job token", "environments": ["ci"], "secret": true, "owner": "github-actions", "required": "ci", "safe_diagnostic": "metadata_presence_only" },
      "GH_INSTALLATION_TOKEN_EVIDENCE_FILE": { "purpose": "Protected 0600 GitHub App token-issuance response used to bind its permission map to GH_TOKEN", "environments": ["ops"], "secret": false, "owner": "github", "required": "github_app_audit_only", "safe_diagnostic": "metadata_presence_only" },
      "GH_TOKEN": { "purpose": "Explicit read-only GitHub CLI audit identity", "environments": ["ops"], "secret": true, "owner": "github", "required": "agent_access_audit", "safe_diagnostic": "metadata_presence_only" },
      "GIT_COMMIT_SHA": { "purpose": "Non-Vercel deployment commit identity", "environments": ["production", "development", "local"], "secret": false, "owner": "deployment", "required": "optional", "safe_diagnostic": "value_non_secret" },
      "HARNESS_INIT_ANCHOR_CONFIG": { "purpose": "Local init anchor handoff config", "environments": ["local"], "secret": true, "owner": "local-init", "required": "ephemeral", "safe_diagnostic": "metadata_presence_only" },
      "HARNESS_INIT_ANCHOR_NONCE": { "purpose": "Local init anchor nonce", "environments": ["local"], "secret": true, "owner": "local-init", "required": "ephemeral", "safe_diagnostic": "metadata_presence_only" },
      "HARNESS_INIT_PREREQUISITE_TIMEOUT_MS": { "purpose": "Local prerequisite timeout", "environments": ["local"], "secret": false, "owner": "local-init", "required": "optional", "safe_diagnostic": "value_non_secret" },
      "HARNESS_INIT_READY_TIMEOUT_MS": { "purpose": "Local readiness timeout", "environments": ["local"], "secret": false, "owner": "local-init", "required": "optional", "safe_diagnostic": "value_non_secret" },
      "HARNESS_INIT_STATE": { "purpose": "Local init state directory", "environments": ["local"], "secret": false, "owner": "local-init", "required": "runtime", "safe_diagnostic": "path_basename_only" },
      "HARNESS_INIT_SUPERVISOR_CONFIG": { "purpose": "Local supervisor handoff config", "environments": ["local"], "secret": true, "owner": "local-init", "required": "ephemeral", "safe_diagnostic": "metadata_presence_only" },
      "HARNESS_INIT_SUPERVISOR_NONCE": { "purpose": "Local supervisor nonce", "environments": ["local"], "secret": true, "owner": "local-init", "required": "ephemeral", "safe_diagnostic": "metadata_presence_only" },